{
  "jobId": "11111111-1111-4111-8111-111111111111",
  "idempotencyKey": "22222222-2222-4222-8222-222222222222",
  "status": "QUEUED",
  "schemaVersion": 1,
  "createdAt": "2026-08-23T12:00:00Z",
  "inputSha256": "aaaaaaaaaaaaaaaaaaaaaaaaaaaaaaaaaaaaaaaaaaaaaaaaaaaaaaaaaaaaaaaa",
  "pipelineVersion": "pipeline-example-1"
}
